{
	"ver": "1.0",
	"timestamp": "2021-07-30 14:21:19.0",
	"txnid": "29ae-11e8-a8d7-0290",
	"requester": {
		"name": "test",
		"id": "testEntity"
	},
	"entityinfo": {
		"name": "test",
		"id": "testEntity",
		"code": "FINVU",
		"oldEntityId": "testEntity",
		"entityhandle": "@finvu",
		"Identifiers": [{
			"category": "STRONG",
			"type": "MOBILE"
		}],
		"baseurl": "https://aauat.finvu.in/API/V1",
		"webviewurl": "https://webvwdev.finvu.in/onboarding",
		"fitypes": [
			"DEPOSIT",
			"RECURRING_DEPOSIT",
			"TERM-DEPOSIT"
		],
		"certificate": {
			"alg": "RS256",
			"e": "AQAB",
			"kid": "f676b688-07a2-450b-abb5-57fbb98ecabe",
			"kty": "RSA",
			"n": "pOFhy12KFAcIwG-vKqkMWCc8oxAbEmB7_sakwxBYN1NudI1mddWdzUhUU38M1B3McDs-actIRDxisNvFMLOwqzQCojQiuao8fh9z8roxEEZx_LR5zG-S6xNbcsMl76FoYpYofKWfNf5Nxnc_FRcS2Yi38XaGXez5Z3JO_NvNtzZtvVjGSRlXUjEBN8q2o4c-o_fA5RVsKX57duOXLWeO6jMzhulrnSEWSv0dTvH1OeJGjtF4csXro0NWa8C9F9MUwP7juH90gmrAKacFkLPaU_uyBZzwu3w14Sa4jru2g7oYVMs0IDZnwYXUw-SgixHAghMpQwKBNwCphHI9QAN0qw",
			"use": "sig"
		},
		"tokeninfo": {
			"url": "https://www.finvu.in/aa/tokens/",
			"maxcalls": 1,
			"desc": "String"
		},
		"signature": {
			"signValue": "u2j8DsVyT1azpJC_NG84Ty5KKthuCaPod7iI7w0LK9orSMhBEwwZDCxTWq4aYWAchc8"
		},
		"inboundports": [
			"8080"
		],
		"outboundports": [
			"9595"
		],
		"ips": [
			"103.224.243.153",
			"103.224.243.227"
		]
	}
}